{
  "schema_version": 1,
  "operation": "plan",
  "scene": {
    "frame": {
      "id": "world",
      "units": "m",
      "axes": "x-right-y-up"
    },
    "observed_at": "2026-10-10T12:00:00Z",
    "source": "synthetic",
    "complete": true,
    "uncertainty": 0,
    "objects": [
      {
        "id": "wall",
        "shape": {
          "type": "rectangle",
          "min": [
            2,
            -1
          ],
          "max": [
            4,
            1
          ]
        }
      }
    ],
    "workspace": {
      "type": "rectangle",
      "min": [
        -1,
        -3
      ],
      "max": [
        7,
        3
      ]
    }
  },
  "query": {
    "as_of": "2026-10-10T12:00:01Z",
    "start": [
      0,
      0
    ],
    "goal": [
      6,
      0
    ],
    "radius": 0.25,
    "margin": 0.1,
    "grid": {
      "min": [
        -1,
        -3
      ],
      "max": [
        7,
        3
      ],
      "step": 0.5,
      "max_nodes": 1000
    }
  }
}
